claim_id,instance_id,claim_number,patient_name,service_date,transaction_date,payer,payer_id,charges,sequence,status,status_detail,provider,workgroup,has_remit,is_held,is_open,notice_code,scraped_at,pdf_path,pdf_downloaded,pdf_error
11893043325,12241750816,PV410470118,"JACKSON, JASMINE",6/5/2026,06/09/2026,GEICO INSURANCE (J1747),J1747,360.0,1,Rejected by Waystar,"Type of Accident Required When Accident Date Is Present. Acceptable values are AA = Auto Accident, EM = Employment, OA = Other Accident. [X12 Info: 2300-CLM11]","ANTONETTE, MARIE",Manhattan Cluster,False,False,False,0,2026-06-10T18:25:43.818219+00:00,pdfs/rejected_2025_2026/PV410470118_11893043325.pdf,True,
11893043323,12241750742,PV410304824,"RODRIGUEZ, JENILYN",6/5/2026,06/09/2026,GEICO INSURANCE (J1747),J1747,370.0,1,Rejected by Waystar,PATIENT/SUBSCRIBER ZIP CODE (11111) is invalid. Value must be a valid Zip Code as defined by the US Postal Service. This information can be verified at www.USPS.com. [X12 Info: 2010BA-N403],"ANTONETTE, MARIE",Manhattan Cluster,False,False,False,0,2026-06-10T18:25:43.818652+00:00,pdfs/rejected_2025_2026/PV410304824_11893043323.pdf,True,
11893040461,12241750147,PV410174179,"DRUMMOND, STEPHEN",6/5/2026,06/09/2026,MAGNACOMP (11303),11303,260.0,1,Rejected by Waystar,This Payer Requires A Subscriber Entity Type of Individual (1). Cannot Be Organization. [X12 Info: 2010BA-NM102],"ALBASYOUNY, HANY",Upper Brooklyn Cluster,False,False,False,0,2026-06-10T18:25:43.819064+00:00,pdfs/rejected_2025_2026/PV410174179_11893040461.pdf,True,
11893040729,12241749876,PV410081306,"ENGDA, YESUSAWIT JESSIE",6/4/2026,06/09/2026,GEICO INSURANCE (J1747),J1747,300.0,1,Rejected by Waystar,"Type of Accident Required When Accident Date Is Present. Acceptable values are AA = Auto Accident, EM = Employment, OA = Other Accident. [X12 Info: 2300-CLM11]","MAHMOUD, MUHAMMAD ABDELFATTAH",Upper Brooklyn Cluster,False,False,False,0,2026-06-10T18:25:43.819474+00:00,pdfs/rejected_2025_2026/PV410081306_11893040729.pdf,True,
11893039410,12241749658,PV410534569,"DATTANI, RUCHI",6/7/2026,06/09/2026,BCBSHMO (SB803),SB803,430.0,1,Rejected by Waystar,Patient/Subscriber City is invalid. [X12 Info: 2010BA-N401]PATIENT/SUBSCRIBER ZIP CODE (11111) is invalid. Value must be a valid Zip Code as defined by the US Postal Service. This information can be verified at www.USPS.com. [X12 Info: 2010BA-N403],"MAHMOUD, MUHAMMAD ABDELFATTAH",Upper Brooklyn Cluster,False,False,False,0,2026-06-10T18:25:43.819885+00:00,pdfs/rejected_2025_2026/PV410534569_11893039410.pdf,True,
11893039775,12241749643,PV49979060,"VAZQUEZ, BENITO",6/4/2026,06/09/2026,NYCE PPO (26992),26992,375.0,1,Rejected by Payer,"CLAIM REJECTED FOR MISSING OR INVALID INFORMATION. THIS MESSAGE SHOULD BE ACCOMPANIED BY ANOTHER MORE DESCRIPTIVE REJECTION MESSAGE. [X12 Info: 2300-CLM] A3 P4999UMRRCPDN SMARTEDIT (UMRRCPDN) INFORMATIONAL - PROCEDURE 97014 IS NOT AN APPROPRIATE CODE FOR SERVICES RENDERED. REPORT THE STATUS A (ACTIVE) CODE THAT BEST DESCRIBES THE SERVICES PROVIDED. CLAIM REJECTED FOR MISSING OR INVALID INFORMATION. THIS MESSAGE SHOULD BE ACCOMPANIED BY ANOTHER MORE DESCRIPTIVE REJECTION MESSAGE. [X12 Info: 2300-CLM] A7 P4999UMRAMRMR SMARTEDIT (UMRAMRMR) REJECT - PROCEDURE CODE 29530 MAY NEED TO BE SUBMITTED WITH AN ANATOMICAL MODIFIER. THE MOST SPECIFIC MODIFIER TO REPRESENT THE ANATOMICAL SITE SHOULD BE REPORTED. UPDATE CODE(S) AS APPLICABLE. SMARTEDIT REJINFO (REJINFO) [PATTERN 53845] INFORMATIONAL - THIS CLAIM HAS BEEN REJECTED AND WILL NOT BE PROCESSED. SEE UHCPROVIDER.COM/SMARTEDITS. REPAIRED CLAIMS SHOULD BE SENT WITH THE ORIGINAL FREQUENCY CODE, NOT A REPLACEMENT OR VOIDED INDICATOR [X12 INFO: 2300-CLM]","JADAV, JHANVI",Lower Brooklyn Cluster,False,False,False,2,2026-06-10T18:25:43.820300+00:00,pdfs/rejected_2025_2026/PV49979060_11893039775.pdf,True,
11893039855,12241749638,PV410454253,"GAMEZ, ADALJIRA",6/5/2026,06/09/2026,US FAMILY HEALTH PLAN (90551),90551,250.0,1,Rejected by Intermediary,CLAIM HAS BEEN REJECTED AS UNPROCESSABLE. MISSING OR INVALID INFORMATION. MEMBER ID NOT FOUND OR EMPTY. [X12 INFO: 2010BA-NM1],"ELHADDAD, NOORHAN",Lower Brooklyn Cluster,False,False,False,1,2026-06-10T18:25:43.820728+00:00,pdfs/rejected_2025_2026/PV410454253_11893039855.pdf,True,
11893039081,12241749520,PV410512809,"JONES, ANGIL",6/4/2026,06/09/2026,FIDELISMEDICARE (11334),11334,375.0,1,Rejected by Waystar,PATIENT/SUBSCRIBER ZIP CODE (12003) is invalid. Value must be a valid Zip Code as defined by the US Postal Service. This information can be verified at www.USPS.com. [X12 Info: 2010BA-N403]OTHER Subscriber ZIP CODE (12003) listed under the Payer not being billed is invalid. Must be a valid Zip Code as defined by the US Postal Service. This information can be verified at www.USPS.com. [X12 Info: 2330A-N403],"BALDANIYA, JANAK",Upper Brooklyn Cluster,False,False,False,0,2026-06-10T18:25:43.821143+00:00,pdfs/rejected_2025_2026/PV410512809_11893039081.pdf,True,
11851504212,12237516144,PV410393622,"NITHMER, MARTIN",5/30/2026,06/08/2026,BCBS New York Empire (SB803),SB803,280.0,1,Rejected by Waystar,"Subscriber Entity Type is missing. Make sure the Subscriber Entity (Organization or Individual) is selected. [X12 Info: 2010BA-NM102]SUBSCRIBER LAST NAME is missing. Check to make sure the Subscriber's Last Name is present on all insurances listed on the claim. [X12 Info: 2010BA-NM103]Patient Relationship to Insured Is Missing. Valid values for 5010 are 01, 19, 20, 21, 39, 40, 53, G8. [X12 Info: 2000C-PAT01]","METWALLY, SALMA",Manhattan Cluster,False,False,False,0,2026-06-10T18:25:43.821558+00:00,pdfs/rejected_2025_2026/PV410393622_11851504212.pdf,True,
11874400290,12237496528,PV410393622,"NITHMER, MARTIN",5/28/2026,06/08/2026,BCBS New York Empire (SB803),SB803,280.0,1,Rejected by Waystar,"Subscriber Entity Type is missing. Make sure the Subscriber Entity (Organization or Individual) is selected. [X12 Info: 2010BA-NM102]SUBSCRIBER LAST NAME is missing. Check to make sure the Subscriber's Last Name is present on all insurances listed on the claim. [X12 Info: 2010BA-NM103]Patient Relationship to Insured Is Missing. Valid values for 5010 are 01, 19, 20, 21, 39, 40, 53, G8. [X12 Info: 2000C-PAT01]","BORAD, PRINSI",Manhattan Cluster,False,False,False,0,2026-06-10T18:25:43.821974+00:00,pdfs/rejected_2025_2026/PV410393622_11874400290.pdf,True,
11851500857,12237376111,PV49948675,"OCCELUS, MAGALIE",5/29/2026,06/08/2026,1199 (13162),13162,280.0,1,Rejected by Payer,A3:21:41 CLAIM HAS BEEN REJECTED AS UNPROCESSABLE. MISSING OR INVALID INFORMATION. SUBMITTER PAYER SPECIFIC REJECTION - INVALID MEMBER ID 902775410601 - MUST BE LENGTH 9 OR 10 AND NUMERIC ONLY LINE 78944 LOOP 2010BA SUBSCRIBER PRIMARY IDENTIFIER,"CHAVDA, RADHIKA",Upper Brooklyn Cluster,False,False,False,2,2026-06-10T18:25:43.822396+00:00,pdfs/rejected_2025_2026/PV49948675_11851500857.pdf,True,
11825840362,12237371954,PV49948675,"OCCELUS, MAGALIE",5/19/2026,06/08/2026,1199 (13162),13162,280.0,1,Rejected by Payer,A3:21:41 CLAIM HAS BEEN REJECTED AS UNPROCESSABLE. MISSING OR INVALID INFORMATION. SUBMITTER PAYER SPECIFIC REJECTION - INVALID MEMBER ID 902775410601 - MUST BE LENGTH 9 OR 10 AND NUMERIC ONLY LINE 78898 LOOP 2010BA SUBSCRIBER PRIMARY IDENTIFIER,"OSMAN, DALIA",Upper Brooklyn Cluster,False,False,False,2,2026-06-10T18:25:43.822807+00:00,pdfs/rejected_2025_2026/PV49948675_11825840362.pdf,True,
11867058518,12237371949,PV49948675,"OCCELUS, MAGALIE",6/2/2026,06/08/2026,1199 (13162),13162,280.0,1,Rejected by Payer,A3:21:41 CLAIM HAS BEEN REJECTED AS UNPROCESSABLE. MISSING OR INVALID INFORMATION. SUBMITTER PAYER SPECIFIC REJECTION - INVALID MEMBER ID 902775410601 - MUST BE LENGTH 9 OR 10 AND NUMERIC ONLY LINE 78852 LOOP 2010BA SUBSCRIBER PRIMARY IDENTIFIER,"OSMAN, DALIA",Upper Brooklyn Cluster,False,False,False,2,2026-06-10T18:25:43.823222+00:00,pdfs/rejected_2025_2026/PV49948675_11867058518.pdf,True,
11797896849,12237369944,PV49948675,"OCCELUS, MAGALIE",5/20/2026,06/08/2026,1199 (13162),13162,280.0,1,Rejected by Payer,A3:21:41 CLAIM HAS BEEN REJECTED AS UNPROCESSABLE. MISSING OR INVALID INFORMATION. SUBMITTER PAYER SPECIFIC REJECTION - INVALID MEMBER ID 902775410601 - MUST BE LENGTH 9 OR 10 AND NUMERIC ONLY LINE 78760 LOOP 2010BA SUBSCRIBER PRIMARY IDENTIFIER,"CHAVDA, RADHIKA",Upper Brooklyn Cluster,False,False,False,2,2026-06-10T18:25:43.823636+00:00,pdfs/rejected_2025_2026/PV49948675_11797896849.pdf,True,
11833123860,12237369823,PV49948675,"OCCELUS, MAGALIE",5/27/2026,06/08/2026,1199 (13162),13162,280.0,1,Rejected by Payer,A3:21:41 CLAIM HAS BEEN REJECTED AS UNPROCESSABLE. MISSING OR INVALID INFORMATION. SUBMITTER PAYER SPECIFIC REJECTION - INVALID MEMBER ID 902775410601 - MUST BE LENGTH 9 OR 10 AND NUMERIC ONLY LINE 78714 LOOP 2010BA SUBSCRIBER PRIMARY IDENTIFIER,"CHAVDA, RADHIKA",Upper Brooklyn Cluster,False,False,False,2,2026-06-10T18:25:43.824044+00:00,pdfs/rejected_2025_2026/PV49948675_11833123860.pdf,True,
11880810786,12229221348,PV410393622,"NITHMER, MARTIN",6/4/2026,06/06/2026,NORTHWELL DIRECT (36149),36149,280.0,1,Rejected by Payer,"A3:21 CLAIM HAS BEEN REJECTED AS UNPROCESSABLE. MISSING OR INVALID INFORMATION. RESUBMIT TO ANTHEM. SERVICE PROVIDER BORAD, PRINSI (NPI : 1073477378 AND TIN : NULL), BILLING PROVIDER PHYSICAL THERAPY OF THE CITY (NPI : 1265940399 AND TIN : 823830674).","BORAD, PRINSI",Manhattan Cluster,False,False,False,2,2026-06-10T18:25:43.824459+00:00,pdfs/rejected_2025_2026/PV410393622_11880810786.pdf,True,
11874400638,12222521694,PV410419439,"FRANCIS, DONALD",6/3/2026,06/05/2026,1199 (13162),13162,300.0,1,Rejected by Payer,A3:21:41 CLAIM HAS BEEN REJECTED AS UNPROCESSABLE. MISSING OR INVALID INFORMATION. SUBMITTER PAYER SPECIFIC REJECTION - INVALID MEMBER ID 980020070701 - MUST BE LENGTH 9 OR 10 AND NUMERIC ONLY LINE 77478 LOOP 2010BA SUBSCRIBER PRIMARY IDENTIFIER,"EZENWUGO, CHIBUZO",Upper Brooklyn Cluster,False,False,False,2,2026-06-10T18:25:43.824871+00:00,pdfs/rejected_2025_2026/PV410419439_11874400638.pdf,True,
11874400024,12222521746,PV410465043,"LUIS MANZANARES, JORGE",5/30/2026,06/05/2026,HEALTHFIRST (80141),80141,300.0,1,Rejected by Waystar,"Subscriber ID does not match allowable pattern for this payer. Please verify members ID card and payer. [X12 Info: 2010BA-NM109]Subscriber ID is invalid. Must not be Equal to repetitive numbers or letters or the literals Individual, Unknown, Self, None, 1234567890, or 123456789 for this payer. [X12 INFO: 2010BA-NM109]","ELKOUMY, RAMY",Bronx Cluster,False,False,False,0,2026-06-10T18:25:43.825281+00:00,pdfs/rejected_2025_2026/PV410465043_11874400024.pdf,True,
11565639758,12218623909,PV410415617,"MOJICA ACOSTA, SAMIR",4/20/2026,06/04/2026,UNITED HEALTH CARE (87726),87726,210.0,1,Rejected by Payer,"CLAIM REJECTED FOR MISSING OR INVALID INFORMATION. THIS MESSAGE SHOULD BE ACCOMPANIED BY ANOTHER MORE DESCRIPTIVE REJECTION MESSAGE. [X12 Info: 2300-CLM] A3 P4999NCCSD SMARTEDIT (NCCSD) THE FOLLOWING CODE 97110 IS NOT A COVERED SERVICE. A3 P4999INFO SMARTEDIT (INFO) [PATTERN 55018] FOR ADDITIONAL INFORMATION REGARDING THIS EDIT, REFER TO OUR SMART EDITS GUIDE AT UHCPROVIDER.COM/SMARTEDITS. ","ANTONETTE, MARIE",Manhattan Cluster,True,False,False,2,2026-06-10T18:25:43.825694+00:00,pdfs/rejected_2025_2026/PV410415617_11565639758.pdf,True,
11797898304,12208697456,PV410478229,"OJO, RACHEL",5/20/2026,06/03/2026,BCBS NEW YORK EMPIRE (SB803),SB803,310.0,1,Rejected by Payer,REJECTED FOR INVALID INFORMATION. RENDERING PROVIDER NOT ON FILE FOR THE BILLING PROVIDER ADDRESS SUBMITTED. PLEASE UTILIZE THE PROVIDER DATA MANAGEMENT AT WWW.AVAILITY.COM FOR NEW PROVIDER ADD OR CONTACT PROVIDER SERVICES. [X12 INFO: 2310B-NM1]ACKNOWLEDGEMENT/REJECTED FOR MISSING INFORMATION - THE CLAIM/ENCOUNTER IS MISSING THE INFORMATION SPECIFIED IN THE STATUS DETAILS AND HAS BEEN REJECTED. STATUS: ENTITY'S CREDENTIAL/ENROLLMENT INFORMATION. NOTE: THIS CODE REQUIRES USE OF AN ENTITY CODE. ENTITY: RENDERING PROVIDER. [X12 Info: Prof:2310B Inst:2310D],"BHANSALI, VIRAL",Bronx Cluster,False,False,False,2,2026-06-10T18:25:43.826112+00:00,pdfs/rejected_2025_2026/PV410478229_11797898304.pdf,True,
11782576355,12208697268,PV410478229,"OJO, RACHEL",5/18/2026,06/03/2026,BCBS NEW YORK EMPIRE (SB803),SB803,310.0,1,Rejected by Payer,REJECTED FOR INVALID INFORMATION. RENDERING PROVIDER NOT ON FILE FOR THE BILLING PROVIDER ADDRESS SUBMITTED. PLEASE UTILIZE THE PROVIDER DATA MANAGEMENT AT WWW.AVAILITY.COM FOR NEW PROVIDER ADD OR CONTACT PROVIDER SERVICES. [X12 INFO: 2310B-NM1]ACKNOWLEDGEMENT/REJECTED FOR MISSING INFORMATION - THE CLAIM/ENCOUNTER IS MISSING THE INFORMATION SPECIFIED IN THE STATUS DETAILS AND HAS BEEN REJECTED. STATUS: ENTITY'S CREDENTIAL/ENROLLMENT INFORMATION. NOTE: THIS CODE REQUIRES USE OF AN ENTITY CODE. ENTITY: RENDERING PROVIDER. [X12 Info: Prof:2310B Inst:2310D],"BHANSALI, VIRAL",Bronx Cluster,False,False,False,2,2026-06-10T18:25:43.826527+00:00,pdfs/rejected_2025_2026/PV410478229_11782576355.pdf,True,
11782576352,12208691545,PV410394867,"SILVA, CHRISTOPHER",5/18/2026,06/03/2026,BCBS NEW YORK EMPIRE (SB803),SB803,310.0,1,Rejected by Payer,REJECTED FOR INVALID INFORMATION. RENDERING PROVIDER NOT ON FILE FOR THE BILLING PROVIDER ADDRESS SUBMITTED. PLEASE UTILIZE THE PROVIDER DATA MANAGEMENT AT WWW.AVAILITY.COM FOR NEW PROVIDER ADD OR CONTACT PROVIDER SERVICES. [X12 INFO: 2310B-NM1]ACKNOWLEDGEMENT/REJECTED FOR MISSING INFORMATION - THE CLAIM/ENCOUNTER IS MISSING THE INFORMATION SPECIFIED IN THE STATUS DETAILS AND HAS BEEN REJECTED. STATUS: ENTITY'S CREDENTIAL/ENROLLMENT INFORMATION. NOTE: THIS CODE REQUIRES USE OF AN ENTITY CODE. ENTITY: RENDERING PROVIDER. [X12 Info: Prof:2310B Inst:2310D],"BHANSALI, VIRAL",Bronx Cluster,False,False,False,2,2026-06-10T18:25:43.826940+00:00,pdfs/rejected_2025_2026/PV410394867_11782576352.pdf,True,
11797898307,12208681070,PV410443285,"WALKER, BEVERLEY",5/20/2026,06/03/2026,BCBS NEW YORK EMPIRE (SB803),SB803,410.0,1,Rejected by Payer,REJECTED FOR INVALID INFORMATION. RENDERING PROVIDER NOT ON FILE FOR THE BILLING PROVIDER ADDRESS SUBMITTED. PLEASE UTILIZE THE PROVIDER DATA MANAGEMENT AT WWW.AVAILITY.COM FOR NEW PROVIDER ADD OR CONTACT PROVIDER SERVICES. [X12 INFO: 2310B-NM1]ACKNOWLEDGEMENT/REJECTED FOR MISSING INFORMATION - THE CLAIM/ENCOUNTER IS MISSING THE INFORMATION SPECIFIED IN THE STATUS DETAILS AND HAS BEEN REJECTED. STATUS: ENTITY'S CREDENTIAL/ENROLLMENT INFORMATION. NOTE: THIS CODE REQUIRES USE OF AN ENTITY CODE. ENTITY: RENDERING PROVIDER. [X12 Info: Prof:2310B Inst:2310D],"BHANSALI, VIRAL",Bronx Cluster,False,False,False,2,2026-06-10T18:25:43.827351+00:00,pdfs/rejected_2025_2026/PV410443285_11797898307.pdf,True,
11859309724,12206886705,PV49975813,"BENN, DULCINA",5/28/2026,06/03/2026,1199 (13162),13162,410.0,1,Rejected by Payer,A3:21 CLAIM HAS BEEN REJECTED AS UNPROCESSABLE. MISSING OR INVALID INFORMATION. ACKNOWLEDGEMENT REJECTED FOR INVALID INFORMATION-THE CLAIM ENCOUNTER IS HAS INVALID INFORMATION SPECIFIED IN THE STATUS DETAILS AND HAS BEEN REJECTED. STATUS DETAILS NOT FOUND. USAGE THIS CODE REQUIRES USE OF AN ENTIT..(REVIEW CLAIM DETAILS ONLINE),"BORAD, PRINSI",Manhattan Cluster,False,False,False,2,2026-06-10T18:25:43.827765+00:00,pdfs/rejected_2025_2026/PV49975813_11859309724.pdf,True,
11859307901,12206885682,PV410491480,"POW, ZENYIAH",5/27/2026,06/03/2026,EMBLEMHIP (55247),55247,385.0,1,Rejected by Payer,"Claim has been Rejected as unprocessable. Cannot provide further status electronically. [X12 Info: 2300-CLM]PATIENT and/or SUBSCRIBER eligibility is not found with payer based on the submitted information. Rejection Often Related to Missing or Invalid Group Number, Incorrect Patient or Subscriber Name, or Incorrect Subscriber Member ID. Verify that the patient information on the claim and electronic payer id matches the members ID card exactly. If this is a W/C claim: Often occurs when the name does not match what the employer has filed on the claim. [X12 Info: 2010BA-NM1]Claim Has Been Returned as Unprocessable. Refer to accompanying rejection message (if present) for details. [X12 INFO: 2300-CLM]EMBLEM UNABLE TO LOCATE ELIGIBILITY SPAN FOR THE PATIENT. [X12 INFO: 2010BA/CA-NM1]","MAHMOUD, MUHAMMAD ABDELFATTAH",Upper Brooklyn Cluster,False,False,False,2,2026-06-10T18:25:43.828185+00:00,pdfs/rejected_2025_2026/PV410491480_11859307901.pdf,True,
11628184527,12191466587,PV410451032,"RAMKHELAWAN, KELLY",4/25/2026,06/01/2026,1199 National Benefit Fund (13162),13162,460.0,1,Rejected by Payer,A3:21 CLAIM HAS BEEN REJECTED AS UNPROCESSABLE. MISSING OR INVALID INFORMATION. ACKNOWLEDGEMENT REJECTED FOR INVALID INFORMATION-THE CLAIM ENCOUNTER IS HAS INVALID INFORMATION SPECIFIED IN THE STATUS DETAILS AND HAS BEEN REJECTED. STATUS DETAILS NOT FOUND. USAGE THIS CODE REQUIRES USE OF AN ENTIT..(REVIEW CLAIM DETAILS ONLINE),"ABOUSHOKKA, MOSTAFA",Upper Brooklyn Cluster,True,False,False,2,2026-06-10T18:25:43.828597+00:00,pdfs/rejected_2025_2026/PV410451032_11628184527.pdf,True,
11839294274,12186313304,PV49975898,"MARIN SINISTERRA, LEONARD A",5/28/2026,05/30/2026,NEW JERSEY MANUFACTURERS INSURANCE (12122W),12122W,250.0,1,Rejected by Payer,PATIENT and/or SUBSCRIBER eligibility is not found with payer based on the submitted information. Verify that the patient information on the claim and electronic payer id matches the members ID card exactly. [X12 Info: 2010BA],"THAKKAR, PARTH",Manhattan Cluster,False,False,False,2,2026-06-10T18:25:43.829009+00:00,pdfs/rejected_2025_2026/PV49975898_11839294274.pdf,True,
11833126886,12179834916,PV410314060,"FILIPOVIC, SENKA",5/26/2026,05/29/2026,BCBSPPO (SB803),SB803,310.0,1,Rejected by Payer,REJECTED FOR INVALID INFORMATION. RENDERING PROVIDER NOT ON FILE FOR THE BILLING PROVIDER ADDRESS SUBMITTED. PLEASE UTILIZE THE PROVIDER DATA MANAGEMENT AT WWW.AVAILITY.COM FOR NEW PROVIDER ADD OR CONTACT PROVIDER SERVICES. [X12 INFO: 2310B-NM1]ACKNOWLEDGEMENT/REJECTED FOR MISSING INFORMATION - THE CLAIM/ENCOUNTER IS MISSING THE INFORMATION SPECIFIED IN THE STATUS DETAILS AND HAS BEEN REJECTED. STATUS: ENTITY'S CREDENTIAL/ENROLLMENT INFORMATION. NOTE: THIS CODE REQUIRES USE OF AN ENTITY CODE. ENTITY: RENDERING PROVIDER. [X12 Info: Prof:2310B Inst:2310D],"BHANSALI, VIRAL",Manhattan Cluster,False,False,False,2,2026-06-10T18:25:43.829420+00:00,pdfs/rejected_2025_2026/PV410314060_11833126886.pdf,True,
11833123871,12179834025,PV49944522,"BENJAMIN, STEPHANIE",5/27/2026,05/29/2026,1199 (13162),13162,280.0,1,Rejected by Payer,A3:21 CLAIM HAS BEEN REJECTED AS UNPROCESSABLE. MISSING OR INVALID INFORMATION. ACKNOWLEDGEMENT REJECTED FOR INVALID INFORMATION-THE CLAIM ENCOUNTER IS HAS INVALID INFORMATION SPECIFIED IN THE STATUS DETAILS AND HAS BEEN REJECTED. STATUS DETAILS NOT FOUND. USAGE THIS CODE REQUIRES USE OF AN ENTIT..(REVIEW CLAIM DETAILS ONLINE),"CHAVDA, RADHIKA",Upper Brooklyn Cluster,False,False,False,2,2026-06-10T18:25:43.829829+00:00,pdfs/rejected_2025_2026/PV49944522_11833123871.pdf,True,
11833123869,12179833821,PV49944522,"BENJAMIN, STEPHANIE",5/22/2026,05/29/2026,1199 (13162),13162,430.0,1,Rejected by Payer,A3:21 CLAIM HAS BEEN REJECTED AS UNPROCESSABLE. MISSING OR INVALID INFORMATION. ACKNOWLEDGEMENT REJECTED FOR INVALID INFORMATION-THE CLAIM ENCOUNTER IS HAS INVALID INFORMATION SPECIFIED IN THE STATUS DETAILS AND HAS BEEN REJECTED. STATUS DETAILS NOT FOUND. USAGE THIS CODE REQUIRES USE OF AN ENTIT..(REVIEW CLAIM DETAILS ONLINE),"CHAVDA, RADHIKA",Upper Brooklyn Cluster,False,False,False,2,2026-06-10T18:25:43.830531+00:00,pdfs/rejected_2025_2026/PV49944522_11833123869.pdf,True,
