claim_id,instance_id,claim_number,patient_name,service_date,transaction_date,payer,payer_id,charges,sequence,status,status_detail,provider,workgroup,has_remit,is_held,is_open,notice_code,scraped_at,pdf_path,pdf_downloaded,pdf_error
11357954354,11951671693,PV410195670,"GUEBARA, MILAGROUS",3/26/2026,04/27/2026,EMBLEM MEDICAID (55247),55247,340.0,1,Rejected by Payer,Original Reference Number (Payer Claim Control Number) is invalid. Must be 12 digits for payer. Please use the ICN from the first submission of the claim. [X12 Info: 2300-REF02]REJECTED FOR INVALID INFORMATION - NO FURTHER INFORMATION PROVIDED BY THE PAYER [X12 INFO: 2300-CLM]CLAIM HAS BEEN REJECTED FOR MISSING OR INVALID INFORMATION. FURTHER INFORMATION MAY NOT HAVE BEEN PROVIDED BY THE PAYER. . [X12 Info: 2300-CLM]ACK REJECTED FOR INVALID INFORMATION. CLAIM ENCOUNTER HAS INVALID INFORMATION AS SPECIFIED IN STATUS DETAILS AND BEEN REJECTED. MISSING OR INVALID INFORMATION. [X12 INFO: 2300-CLM] 2026089T0023700 ORIGINAL REFERENCE NUMBER MUST BE 12 CHARACTERS. ,"HASSANEN, MOAMEN",Not in a WorkGroup,True,False,False,2,2026-06-10T18:28:58.351029+00:00,pdfs/rejected_2025_2026/PV410195670_11357954354.pdf,True,
11385234877,11951664640,PV410195670,"GUEBARA, MILAGROUS",3/31/2026,04/27/2026,EMBLEM MEDICAID (55247),55247,240.0,1,Rejected by Payer,Original Reference Number (Payer Claim Control Number) is invalid. Must be 12 digits for payer. Please use the ICN from the first submission of the claim. [X12 Info: 2300-REF02]REJECTED FOR INVALID INFORMATION - NO FURTHER INFORMATION PROVIDED BY THE PAYER [X12 INFO: 2300-CLM]CLAIM HAS BEEN REJECTED FOR MISSING OR INVALID INFORMATION. FURTHER INFORMATION MAY NOT HAVE BEEN PROVIDED BY THE PAYER. . [X12 Info: 2300-CLM]ACK REJECTED FOR INVALID INFORMATION. CLAIM ENCOUNTER HAS INVALID INFORMATION AS SPECIFIED IN STATUS DETAILS AND BEEN REJECTED. MISSING OR INVALID INFORMATION. [X12 INFO: 2300-CLM] 2026093T0017500 ORIGINAL REFERENCE NUMBER MUST BE 12 CHARACTERS. ,"HASSANEN, MOAMEN",Not in a WorkGroup,True,False,False,2,2026-06-10T18:28:58.351455+00:00,pdfs/rejected_2025_2026/PV410195670_11385234877.pdf,True,
11344673268,11843551978,PV49969200,"JENNINGS, ANDREA",3/23/2026,04/17/2026,FCS ADMINISTRATORS INC (J3933W),J3933W,390.0,1,Rejected by Payer,REJECTED FOR INVALID INFORMATION. PATIENT ELIGIBILITY NOT FOUND. CLAIM FAILED BENEFITS AND ELIGIBILITY LOOK UP. [X12 INFO: 2010BA-NM109],"BALDANIYA, JANAK",Upper Brooklyn Cluster,False,False,False,2,2026-06-10T18:28:58.351871+00:00,pdfs/rejected_2025_2026/PV49969200_11344673268.pdf,True,
11501783065,11839749794,PV49969200,"JENNINGS, ANDREA",4/8/2026,04/17/2026,FCS ADMINISTRATORS INC (J3933W),J3933W,390.0,1,Rejected by Payer,REJECTED FOR INVALID INFORMATION. PATIENT ELIGIBILITY NOT FOUND. CLAIM FAILED BENEFITS AND ELIGIBILITY LOOK UP. [X12 INFO: 2010BA-NM109],"BETHI, NAINIKA KIRAN REDDY",Upper Brooklyn Cluster,False,False,False,2,2026-06-10T18:28:58.352278+00:00,pdfs/rejected_2025_2026/PV49969200_11501783065.pdf,True,
10904221586,11771219660,PV410145804,"CRUZ THEN, MILAGROS M",1/7/2026,04/10/2026,HEALTHFIRSTMEDICARE (80141),80141,310.0,1,Rejected by Payer,Claim has been rejected. Information submitted on this claim is inconsistent with the payer's billing guidelines. Refer to additional rejection (if present) for details. [X12 Info: 2300-CLM],"ANEES, FATIMA",Not in a WorkGroup,True,False,False,2,2026-06-10T18:28:58.352686+00:00,pdfs/rejected_2025_2026/PV410145804_10904221586.pdf,True,
11257800232,11765533931,PV410157889,"ALI, MDNAMOR",3/11/2026,04/09/2026,BCBS NEW YORK EMPIRE (SB803),SB803,300.0,1,Rejected by Payer,REJECTED FOR INVALID INFORMATION. RENDERING PROVIDER NOT ON FILE FOR THE BILLING PROVIDER ADDRESS SUBMITTED. PLEASE UTILIZE THE PROVIDER DATA MANAGEMENT AT WWW.AVAILITY.COM FOR NEW PROVIDER ADD OR CONTACT PROVIDER SERVICES. [X12 INFO: 2310B-NM1]ACKNOWLEDGEMENT/REJECTED FOR MISSING INFORMATION - THE CLAIM/ENCOUNTER IS MISSING THE INFORMATION SPECIFIED IN THE STATUS DETAILS AND HAS BEEN REJECTED. STATUS: ENTITY'S CREDENTIAL/ENROLLMENT INFORMATION. NOTE: THIS CODE REQUIRES USE OF AN ENTITY CODE. ENTITY: RENDERING PROVIDER. [X12 Info: Prof:2310B Inst:2310D],"ABDELSALAM, YASSER",Not in a WorkGroup,True,False,False,2,2026-06-10T18:28:58.353266+00:00,pdfs/rejected_2025_2026/PV410157889_11257800232.pdf,True,
10873263306,11190123251,PV410012235,"RODRIGUEZ, JUAN",12/29/2025,01/03/2026,OXFORD COMMERCIAL ZAYA (Z96202MC),Z96202MC,445.0,1,Rejected by Waystar,REJECTED FOR PRINT ON FORM [X12 INFO: 2300],"RALLAPALLI, NITHASHA",Not in a WorkGroup,False,False,False,0,2026-06-10T18:28:58.353701+00:00,pdfs/rejected_2025_2026/PV410012235_10873263306.pdf,True,
